step_number,category,action,detailed_instructions,inputs,outputs,how_to_verify,troubleshooting
33,Frontend,Build the production website,"From the frontend/ directory, run: npm run build. This compiles all the React/TypeScript source code into optimized HTML, JavaScript, and CSS files that a web browser can understand. The result goes into a 'dist/' folder.",Input: None. The build reads all files in frontend/src/.,"Output: A dist/ folder is created containing: index.html (the main page), JavaScript bundles (the app logic), and CSS files (the styling). These are the files that will be uploaded to S3 and served to users.","You see 'dist/' folder with files inside it. The terminal shows build completed without errors.","If build fails with TypeScript errors: make sure you ran npm install first. If it fails with 'Cannot find module': delete node_modules and run npm install again."
34,Frontend,Upload the website to S3,"Run: aws s3 sync dist/ s3://YOUR_FRONTEND_BUCKET/ --delete. Replace YOUR_FRONTEND_BUCKET with the FrontendBucketName from step 18 (e.g. 123456789012-rag-frontend). The 'sync' command uploads all new/changed files. The '--delete' flag removes any old files that are no longer in the build.","Input: FrontendBucketName from step 18 (e.g. 123456789012-rag-frontend). Source: the dist/ folder from step 33.","Output: Your website files are now in the S3 bucket. CloudFront (the CDN) will serve these files to users who visit the DistributionUrl.","Terminal shows 'upload: dist/index.html to s3://...' and similar lines for each file.","If you get 'NoSuchBucket': double-check the bucket name from step 18."
35,Frontend,Clear the CloudFront cache,"Run: aws cloudfront create-invalidation --distribution-id YOUR_DIST_ID --paths '/*'. Replace YOUR_DIST_ID with the DistributionId from step 18 (e.g. E1234567890ABC). CloudFront caches (saves copies of) your website files globally. This command tells it to throw away old copies and fetch the fresh ones from S3.","Input: DistributionId from step 18 (e.g. E1234567890ABC).","Output: CloudFront will refresh its cached files globally. This takes 1-2 minutes to complete.","Terminal shows a JSON response with 'Status': 'InProgress' and an 'Id'. The cache clear is happening in the background.","If you get an error: check the DistributionId is correct. It starts with 'E' followed by letters and numbers."
36,Verify,Access the application in your browser,"Open a web browser (Chrome, Firefox, Edge, etc). Go to the DistributionUrl from step 18. It looks like: https://d1234567890abc.cloudfront.net. You MUST be on the IP address you configured in step 13.",Input: DistributionUrl from step 18.,"Output: The RAG Document Tool web application loads. You should see a blue header bar with the app name and 3 navigation tabs: 'Search & Generate', 'File Manager', and 'Audit'.","The page loads and you see the application UI with three tabs.","If you see a '403 Forbidden' error: your current IP address doesn't match what you put in config.ts in step 13. Go to whatismyip.com to check your current IP, update config.ts, and redeploy (step 31). If you see a blank page: wait 2 minutes for the CloudFront cache to clear (step 35), then refresh."
37,Verify,Test the File Manager,"Click the 'File Manager' tab in the navigation bar. You should see your uploaded documents listed in a table, organized by category. Try uploading a new file: click 'Select File', choose a document from your computer, select a category from the dropdown, and click 'Upload File'.","Input: A document file (.pdf, .docx, or .txt) from your computer to test uploading.","Output: The File Manager page shows your existing documents. After uploading, a green success message appears and the new file shows up in the list.","Documents from step 20 appear in the table. A test upload succeeds with a green message.","If no documents appear: check that you uploaded to the correct bucket in step 20. If upload fails: check the Lambda function logs in CloudWatch (AWS Console > CloudWatch > Log groups > search for 'UploadFunction')."
38,Verify,Test the Search feature,"Click the 'Search & Generate' tab. In the text box, type a query related to your documents (e.g. 'What is our technical approach to cloud migration?'). Select a category from the dropdown (or leave as 'All Categories'). Select a writing tone (e.g. 'Professional'). Click 'Search for Relevant Documents'. Wait 5-10 seconds.","Input: A text query related to your uploaded documents. A category selection. A tone selection.","Output: A list of search results appears, each showing: the document filename, a relevance score (percentage), and a passage from the document explaining why it matched your query.","Results appear with filenames, scores, and text passages. Each result has a checkbox for selection.","If no results appear: (1) Make sure KB sync completed successfully in step 30. (2) Wait 2-3 minutes after sync - vectors may need time to become queryable. (3) Try a different query or 'All Categories'. (4) Check CloudWatch logs for the SearchFunction Lambda."
39,Verify,Test the Generation feature,"From the search results in step 38, check the boxes next to one or more results you want to use as references. Click the green 'Proceed with Selected' button. Wait 10-30 seconds while Claude generates a draft document.","Input: Selected search results from step 38 (the passages become reference material for the AI).","Output: A generated draft document appears on screen, written in the tone you selected, using the style and content of the reference documents you chose. You can click 'Copy to Clipboard' to copy the text.","A draft document appears below the search results. It should match the tone you selected and reference content from the selected documents.","If generation fails or takes too long: the Lambda timeout might be too short for very long passages. Check CloudWatch logs for the GenerateFunction Lambda."
40,Verify,Test the Audit feature,"Click the 'Audit' tab. Upload two files: (1) In 'Document to Audit' - upload the document you want checked, (2) In 'Criteria / Reference File' - upload a document containing the requirements or criteria. Click 'Run Audit'. Wait 1-2 minutes (this uses a more powerful AI model for thorough analysis).","Input: Two document files - one to audit and one containing criteria/requirements.","Output: A structured audit report showing: an overall score (PASS/PARTIAL/FAIL), each criterion extracted from the reference file, a verdict for each criterion (MEETS/PARTIALLY MEETS/DOES NOT MEET), evidence quotes from the audited document, and improvement recommendations.","A color-coded audit report appears with individual criterion assessments and an overall score.","Audit takes 1-2 minutes because it uses Claude Sonnet (a more powerful but slower model). If it times out: your documents may be very large. Check CloudWatch logs for the AuditFunction Lambda."
41,Maintenance,How to add new documents after initial setup,"Upload the document to S3: aws s3 cp new-file.pdf s3://YOUR_BUCKET/tech-approach/ (use your DocumentsBucketName and appropriate category). Then sync the Knowledge Base: go to Bedrock > Knowledge bases > rag-tool-kb > select data source > click Sync. Or use CLI: aws bedrock-agent start-ingestion-job --knowledge-base-id YOUR_KB_ID --data-source-id YOUR_DS_ID. Wait for sync to complete. The new document is now searchable. NOTE: Documents uploaded through the File Manager UI automatically trigger a sync.","Input: New document file, DocumentsBucketName, and (for CLI sync) Knowledge Base ID and Data Source ID.","Output: The new document is indexed and becomes searchable in the tool.","After sync completes, search for content in the new document and it should appear in results.","CLI uploads need manual sync. UI uploads trigger sync automatically."
42,Maintenance,How to add a new document category,"1. Open cdk/lib/config.ts in a text editor. Find the CATEGORIES array. Add a new entry following the pattern of existing ones (id, label, s3Prefix with trailing slash, description). Save. 2. Redeploy: cd cdk && cdk deploy RagToolStack -c knowledgeBaseId=YOUR_KB_ID -c dataSourceId=YOUR_DS_ID --require-approval broadening. 3. Create the S3 folder: aws s3api put-object --bucket YOUR_BUCKET --key new-category/ --content-length 0. 4. Upload documents to the new folder. 5. Sync the KB (step 41). 6. Rebuild and redeploy frontend: cd frontend && npm run build && aws s3 sync dist/ s3://YOUR_FRONTEND_BUCKET/ --delete","Input: New category name and description. All IDs from earlier steps.","Output: A new category appears in all dropdown menus throughout the application.","The new category shows up in the Search and File Manager dropdowns after redeploying the frontend.","Make sure the s3Prefix ends with a forward slash (e.g. 'cost-volume/')."
43,Maintenance,How to change the allowed IP addresses,"1. Open cdk/lib/config.ts in a text editor. Find the ALLOWED_IPS array. Add or remove IP addresses (each must end with /32 for a single IP). Save. 2. Redeploy: cd cdk && cdk deploy RagToolStack -c knowledgeBaseId=YOUR_KB_ID -c dataSourceId=YOUR_DS_ID --require-approval broadening","Input: New IP addresses to allow (with /32 suffix).","Output: The WAF firewall is updated. New IPs can access the app, removed IPs are blocked.","Try accessing the app from a newly-allowed IP. Try accessing from a removed IP (should get 403).","Changes take effect within a few minutes after deployment."
